{
  "$schema": "https://json-schema.org/draft/2020-12/schema",
  "$id": "https://b7n0de.com/schemas/proofbundle_v0_1.schema.json",
  "title": "proofbundle v0.1",
  "description": "A portable cryptographic evidence bundle: an Ed25519-signed, RFC 6962 Merkle-anchored payload, optionally carrying an SD-JWT selective-disclosure credential.",
  "type": "object",
  "required": ["schema", "payload_b64", "signature", "merkle"],
  "additionalProperties": false,
  "properties": {
    "schema": {
      "const": "proofbundle/v0.1",
      "description": "Bundle format identifier."
    },
    "payload_b64": {
      "type": "string",
      "description": "Base64-encoded payload. The verifier treats it as opaque bytes.",
      "minLength": 1
    },
    "signature": {
      "type": "object",
      "required": ["alg", "public_key_b64", "sig_b64"],
      "additionalProperties": false,
      "properties": {
        "alg": { "const": "ed25519" },
        "public_key_b64": { "type": "string", "minLength": 1 },
        "sig_b64": { "type": "string", "minLength": 1 }
      }
    },
    "merkle": {
      "type": "object",
      "required": ["hash_alg", "leaf_index", "tree_size", "inclusion_proof_b64", "root_b64"],
      "additionalProperties": false,
      "properties": {
        "hash_alg": {
          "type": "string",
          "const": "sha256-rfc6962",
          "description": "RFC 6962 / RFC 9162 SHA-256 tree hashing. REQUIRED (SPEC.md §5) — no `default`: a verifier MUST NOT silently supply this value when the field is absent."
        },
        "leaf_index": { "type": "integer", "minimum": 0 },
        "tree_size": { "type": "integer", "minimum": 1 },
        "inclusion_proof_b64": {
          "type": "array",
          "items": { "type": "string", "minLength": 1 },
          "description": "Sibling hashes of the RFC 6962 inclusion proof, base64-encoded, leaf-to-root order."
        },
        "root_b64": { "type": "string", "minLength": 1 }
      }
    },
    "sd_jwt_vc": {
      "type": "object",
      "description": "Optional embedded SD-JWT selective-disclosure credential.",
      "required": ["compact"],
      "additionalProperties": false,
      "properties": {
        "compact": {
          "type": "string",
          "description": "The SD-JWT in compact serialization (issuer-signed JWT plus ~-separated disclosures).",
          "minLength": 1
        },
        "issuer_public_key_b64": {
          "type": "string",
          "description": "Optional issuer public key; if present the verifier checks the issuer signature. Base64 of the 32-byte raw Ed25519 key (alg EdDSA), or, since Finding 20 (2026-07-15), the 65-byte SEC1 uncompressed P-256 point 0x04||X||Y (alg ES256)."
        }
      }
    },
    "anchors": {
      "type": "array",
      "description": "OPTIONAL, EXPERIMENTAL (SPEC.md §7i / the [anchors] extra): external time-anchor evidence, DETACHED from the signed payload. The offline core verifier tolerates but does NOT verify this field; anchors are checked separately (`verify --require-anchor`). A bundle's crypto verdict is identical whether or not it carries anchors.",
      "items": {
        "type": "object",
        "required": ["type", "target", "canonicalRoot", "proof"],
        "additionalProperties": false,
        "properties": {
          "type": { "type": "string", "description": "Anchor type: `rfc3161-tsa`, `opentimestamps`, or an extension `<org>/<name>/vN`.", "minLength": 1 },
          "target": { "enum": ["receipt", "preRegistration"], "description": "What the anchor's canonicalRoot is the root of. Never mixed: a preRegistration anchor cannot validate a receipt target and vice versa." },
          "canonicalRoot": { "type": "string", "description": "Base64 of the canonical root of the anchor's OWN target.", "minLength": 1 },
          "proof": { "type": "string", "description": "Base64 of the type-specific proof (an RFC 3161 token, an OpenTimestamps proof, ...).", "minLength": 1 },
          "anchoredAt": { "type": ["string", "null"], "description": "RFC 3339 Z, INFORMATIVE only — the trusted time comes from the proof, never this field." },
          "frozen": { "type": "object", "description": "OPTIONAL type-specific material bundled at emit time (e.g. the frozen TSA certificate chain, or an opt-in `policyOid` to pin)." }
        }
      }
    }
  }
}
