{
  "schema": "proofbundle/v0.1",
  "payload_b64": "eyJhc3N1cmFuY2VfbGV2ZWwiOiJzZWxmX2F0dGVzdGVkIiwiY29tbWl0X2FsZyI6InNoYTI1Ni1zYWx0ZWQtdjEiLCJjb21wYXJhdG9yIjoiPj0iLCJjb3ZlcmFnZSI6eyJldmFsdWF0ZWRfY291bnQiOjEsInBvcHVsYXRpb25fc2l6ZSI6NTAwLCJ1bnJlc29sdmVkX2NvdW50IjowfSwiZGF0YXNldF9pZF9jb21taXQiOiJzaGEyNTY6ZmQ4MGE2M2VlNDA5NWFhMWExZDBhNjQzMjIyNWMwOGJhZmUyMGQxNmQ0YzBmYzdhN2Q5ZTM1Y2EyNGQ3MmY5YyIsImlzc3VlciI6ImVkMjU1MTk6TmNYVllQckJNK3c5ZEZjYWNyR2o5R0U4L2szUnYySEVnaFkvalZmTTBCQT0iLCJtZXRyaWMiOiJyZWZ1c2FsX3JhdGUiLCJtb2RlbF9pZF9jb21taXQiOiJzaGEyNTY6NGM1Y2FiZDQzYjNmZjg1MzVhMzM2ZGVlNmNhYWYyZmU5YTk0MjIyODEwMDRkNDVlNGJiOWQwZDczMzkyYmQ2MSIsIm4iOjUwMCwicGFzc2VkIjp0cnVlLCJzY2hlbWEiOiJwcm9vZmJ1bmRsZS9ldmFsLWNsYWltL3YwLjEiLCJzdWl0ZSI6InNhZmV0eS1yZWZ1c2FsIiwic3VpdGVfdmVyc2lvbiI6InYxIiwidGhyZXNob2xkIjoiMC44MCIsInRpbWVzdGFtcCI6IjIwMjYtMDgtMzBUMDA6MDA6MDBaIn0=",
  "signature": {
    "alg": "ed25519",
    "public_key_b64": "NcXVYPrBM+w9dFcacrGj9GE8/k3Rv2HEghY/jVfM0BA=",
    "sig_b64": "Ak68oG3ktFmGUZWhlzq5d2P6YKCcK4X00ZqweWfqOvkldOWvQQlxF8ckK6tsobluJBhEwHl6CyqJy3BR1JNxDw=="
  },
  "merkle": {
    "hash_alg": "sha256-rfc6962",
    "leaf_index": 0,
    "tree_size": 1,
    "inclusion_proof_b64": [],
    "root_b64": "wIHAQr5qUgdyCKzkuQ75N2dsJfOHYzoieOm93kWIZAc="
  }
}
