{
  "schema": "proofbundle/v0.1",
  "payload_b64": "eyJhc3N1cmFuY2VfbGV2ZWwiOiJzZWxmX2F0dGVzdGVkIiwiY29tbWl0X2FsZyI6InNoYTI1Ni1zYWx0ZWQtdjEiLCJjb21wYXJhdG9yIjoiPj0iLCJkYXRhc2V0X2lkX2NvbW1pdCI6InNoYTI1NjpiMGY0NTNjMDBiNGQ5ODg3MTc2ODhhN2NiMWM2OWY5MWU0ZmZiNDRjZmU4MmEzMThkNTg4ZDg5ODE1YzNlMGQyIiwiaXNzdWVyIjoiZWQyNTUxOTpLT3dta2NCVlNzbnE0WFV4Qk5ZRSs4eUljcHM5VWpUL2VLSG1ER3hrMVAwPSIsIm1ldHJpYyI6InBhc3NfcmF0ZSIsIm1vZGVsX2lkX2NvbW1pdCI6InNoYTI1Njo5MDM3OGY1NjBmYzQ4NTRmNzgxMDY3ZjA4YzQ1NjdhZjQ3YWYyZjBmMDg0N2MxMWRjYzE4YjFhZGQyNDhiZWRkIiwibiI6MSwicGFzc2VkIjpmYWxzZSwicHJvdmVuYW5jZSI6eyJleGl0X3N0YXR1cyI6MSwiZ2l0X2NsZWFuIjp0cnVlLCJnaXRfaGFzaCI6IjE3NjI5NWI2YmNjMDAwYTViZjcxODNlZmIwNDI3MzI1ZmIwNDY4NjkiLCJnaXRfdHJlZSI6IjI2MGY4NmUwMDI3ODc0ZWJlOWMyNmIxMDE4YmRkYWQxNmQzZmFkZTgiLCJoYXJuZXNzIjoicHl0ZXN0Iiwibl9lcnJvciI6MCwibl9mYWlsZWQiOjEsIm5fcGFzc2VkIjowLCJuX3NraXBwZWQiOjAsIm5feGZhaWxlZCI6MCwibl94cGFzc2VkIjowLCJ0ZXN0c19wYXNzZWQiOjAsInRlc3RzX3JhbiI6MX0sInNjaGVtYSI6InByb29mYnVuZGxlL2V2YWwtY2xhaW0vdjAuMSIsInN1aXRlIjoicHl0ZXN0Iiwic3VpdGVfdmVyc2lvbiI6ImZpeHR1cmUiLCJ0aHJlc2hvbGQiOiIxIiwidGltZXN0YW1wIjoiMjAyNi0xMC0wOFQxMjowMDowMCswMDowMCJ9",
  "signature": {
    "alg": "ed25519",
    "public_key_b64": "KOwmkcBVSsnq4XUxBNYE+8yIcps9UjT/eKHmDGxk1P0=",
    "sig_b64": "Mg+MV+VGjKf+Mo0IyTylQL0Dw+ICcLkPuZVkWGWjUqIgwRY1JFVIkjMPIQnxRtRxfnwzfWTd682PeQ1saIrcCQ=="
  },
  "merkle": {
    "hash_alg": "sha256-rfc6962",
    "leaf_index": 0,
    "tree_size": 1,
    "inclusion_proof_b64": [],
    "root_b64": "on88NphxXTrITzfdRjEZ3OI953IcwuhL2Ce2Iy+rLB0="
  }
}
