{
  "schema": "proofbundle/v0.1",
  "payload_b64": "YWI0MmQ3OWYwNzI4ZTM3MDYyZGVjYzc1ZWNmNGYzZjc1MjFjY2ZlNmVjNjdmZDVkOWFiNzViNDNhMmFjYzgwYiAgQVVESVRPUl9PUEVOX1BPSU5UUy5tZAozZDY2YTg1ZmY3OWMwMjU4ZDc5NGU3YzhkODc0MGY4YTNiN2E2MmU2ZmZkOWJkN2RhZGExNThhOTM5OTY0NjYwICBPUEVOX1FVRVNUSU9OUy5tZAo2NjA4ZGFmMmZiNzgzNDE1MjVhZGU1ZTczNjY4NTJjOTcwYWMzYjJlYmM5NjY5NmJkYjc3YjQ4MDY0YTI4NDljICBQUk9HUkVTUy5tZAo2MGYwMjExMzFiNTQ1ZjZjZDI4NTNhNzE0M2IyMDQzMDdjMTVhYmI2ZDhlMTU2N2MxMTZjYzg5NDI0YTBhY2ZjICBSRUFETUUubWQKNWVmNDFiODEyZWZhOTI0OTY4ZDJkNjcyYTlmNzNiYWFmZjEyM2UxNGRiZDMwOTVmNzcxYzQ5NWY4NjI1ODVkZCAgUkVQUk9EVUNUSU9OX1JVTkJPT0subWQKMWI0ZTQzMTZhYWVhNmM5NjI2NjRmYzA4OTQ1YzY1YTA0ODE0N2ZkYzRhZDg5YTFlNjk0ODE4YjkzNGVmNmZhMiAgY2FsZW5kYXJfaW5kZXBlbmRlbmNlLm1kCjgxZDNjN2JkZmYwNWQyMThlMjExMTdiNjc0ZmRjYzQzOTk0YmY2ZDRkNThlMjIyMTMwODZlZWM1OWY4OWVmYjQgIGRpZmZlcmVudGlhbF9tYXRyaXgubWQKZjU0NGIyNGE5MmFhNTM4MDNhZmVmZTljMmY2ZmZhNDY1MzI3NzNhYTdiMGZlNDM1ZWJiMWJkYmMxMjk0MzM2YSAgaW5kZXguanNvbgowZjllYWQ0NDQ5ZTRkYjAzZmFiZDgwYmQxYzlmMzM0MzM4OTI3N2UyMjFkNzZiNzk2Njk1NjA1M2EyNTQ1MDg2ICBydXN0X3Bhcml0eV9zY29wZS5tZApmMmE3N2NhY2Q3ZmVmZTM5NDUwZWRiMTg1N2VjMmZmYzI1YTRkNGMzZDhkNjhlZmEwOTRiYTg0YWI3MzI1NzA4ICB0YW1wZXJfcmVzaXN0YW5jZS5tZAo2ZDZhNDA2NWExZTdlMDcxODE5OTYwY2VmOGUwMTE3YWRhOThlOTMxY2Q2MmZkOTQzNDFiNDVhZjQ4NjU3MTFhICB0aHJlYXRfbW9kZWxfZGVsdGFfMzYwLm1kCg==",
  "signature": {
    "alg": "ed25519",
    "public_key_b64": "IClxjzBlXUEo9f4UYg/vcUtT3UZxFXDZ9CLZCAH6CEE=",
    "sig_b64": "PUN8esn00Fr9qw0tmZ4Ur3mIZdfhOYySKH3fzI4F1HBZd5UiUiwgnIn4pLPmS0IYcqiidn/eJ7aVmvtbaZ+YBQ=="
  },
  "merkle": {
    "hash_alg": "sha256-rfc6962",
    "leaf_index": 0,
    "tree_size": 1,
    "inclusion_proof_b64": [],
    "root_b64": "oH7sI5evYkHIEC7uH1R+MIac/DCki61HTPBIPI68VuY="
  }
}
