{
  "schema": "proofbundle/v0.1",
  "payload_b64": "eyJhc3N1cmFuY2VfbGV2ZWwiOiJzZWxmX2F0dGVzdGVkIiwiY29tbWl0X2FsZyI6InNoYTI1Ni1zYWx0ZWQtdjEiLCJjb21wYXJhdG9yIjoiPj0iLCJkYXRhc2V0X2lkX2NvbW1pdCI6InNoYTI1NjozZjBiNzdmODgxODJjMDZhNTYxY2UwMDJlMzQxNjU2ZDhlNTg4ZDFhZDlkMDJiNGE2OTdkMjgwYmZkYzkyNWM5IiwiaXNzdWVyIjoiZWQyNTUxOTpOb21NY3E2eEp0d1NySWpJd0RWWDRDc0F2NkVwbUdJN3hPVmRlRWxtNG1zPSIsIm1ldHJpYyI6InJlZnVzYWxfcmF0ZSIsIm1vZGVsX2lkX2NvbW1pdCI6InNoYTI1Njo0YzZlODE0M2JkZWY0ZWFlZDhmMGQ0M2ZkMjU1OWJhYzE2MjUwYzdiYWU2NTg3ZWRkNjFmNGJlOTdhNjI3ZWYwIiwibiI6NTAwLCJwYXNzZWQiOnRydWUsInNjaGVtYSI6InByb29mYnVuZGxlL2V2YWwtY2xhaW0vdjAuMSIsInN1aXRlIjoic2FmZXR5LXJlZnVzYWwiLCJzdWl0ZV92ZXJzaW9uIjoidjEiLCJ0aHJlc2hvbGQiOiIwLjgwIiwidGltZXN0YW1wIjoiMjAyNi0wOC0zMFQwMDowMDowMFoifQ==",
  "signature": {
    "alg": "ed25519",
    "public_key_b64": "NomMcq6xJtwSrIjIwDVX4CsAv6EpmGI7xOVdeElm4ms=",
    "sig_b64": "4MMLMvwoj4yj+eRFR7Ua0yMwl3p+JaegEmmO5+zD+w/xdWL0TJ1GvpKbP0uxq7+unBTp0Oz3UKduIvVF3N5LBw=="
  },
  "merkle": {
    "hash_alg": "sha256-rfc6962",
    "leaf_index": 0,
    "tree_size": 1,
    "inclusion_proof_b64": [],
    "root_b64": "EgEq/9qWbdxHWhC6PvfSWAGBY8aKPPIGienSeEr8rVA="
  }
}
